{
  "scenarioId": "no-barrier",
  "name": "Free Propagation: Single Source",
  "description": "Remove the barrier entirely. Observe how a single point source produces clean circular ripples with no interference pattern. This is the baseline 鈥?all interference effects require at least two coherent sources.",
  "version": "1.0",
  "screen": "waterDoubleSlit",
  "initialParams": {
    "frequency": 0.4,
    "amplitude": 1.5,
    "barrierEnabled": false,
    "slitSize": 10,
    "slitSeparation": 24
  },
  "paramRanges": {
    "frequency": { "min": 0.1, "max": 1.0, "step": 0.05, "unit": null },
    "amplitude": { "min": 0.2, "max": 3.0, "step": 0.1, "unit": null }
  },
  "successCriteria": [
    {"id":"sc-1","type":"observePattern","description":"Confirm clean circular ripples with no interference bands","params":{"barrierEnabled":false}},
    {"id":"sc-2","type":"toggleBarrier","description":"Enable the double-slit and observe the interference pattern appear","params":{"barrierEnabled":true}}
  ],
  "hints": [
    {"trigger":"always","message":"With no barrier, the wave spreads freely in all directions 鈥?just like dropping a pebble in still water."},
    {"trigger":"always","message":"Toggle Double Slit ON to see what happens when two coherent sources are created."}
  ]
}