{
  "scenarioId": "narrow-slit",
  "name": "Narrow Slits: Widely-Spaced Fringes",
  "description": "Set slits to minimum size (4 px). Narrower slits act more like ideal point sources, producing cleaner interference patterns with less diffraction blur. Observe how each slit individually radiates as a nearly perfect circular source.",
  "version": "1.0",
  "screen": "waterDoubleSlit",
  "initialParams": {
    "frequency": 0.5,
    "amplitude": 2.0,
    "barrierEnabled": true,
    "slitSize": 4,
    "slitSeparation": 16
  },
  "paramRanges": {
    "frequency": { "min": 0.1, "max": 1.0, "step": 0.05, "unit": null },
    "amplitude": { "min": 0.2, "max": 3.0, "step": 0.1, "unit": null },
    "slitSize": { "min": 4, "max": 12, "step": 1, "unit": "px" },
    "slitSeparation": { "min": 12, "max": 24, "step": 1, "unit": "px" }
  },
  "successCriteria": [
    {"id":"sc-1","type":"observePattern","description":"Observe clean, well-defined interference fringes from narrow slits","params":{"maxSlitSize":6}},
    {"id":"sc-2","type":"compareSlitSize","description":"Compare narrow (4px) vs wider (12px) slits: which produces cleaner fringes?","params":{}}
  ],
  "hints": [
    {"trigger":"always","message":"Narrow slits approximate ideal point sources, producing the cleanest interference pattern."},
    {"trigger":"always","message":"Huygens principle: each point on a wavefront acts as a new source. Narrow slits = closer to a true point source."}
  ]
}